question_index,fix_name,fix_description,reason,tag,tag_cluster
0,Fix symptom facts to use proper Prolog syntax,"Replace 'symptom(patient(X), ...)' with ground facts like 'symptom(patient1, sudden_weakness_left_arm).' since using uninstantiated variables X in facts is syntactically problematic and does not behave as intended in Prolog.","In Prolog, variables in facts are implicitly universally quantified, but the pattern 'patient(X)' with an unbound X in a fact does not represent a specific patient and can cause unintended unification behavior. Using a concrete atom like 'patient1' makes the facts ground and unambiguous.",singleton variable,31
0,Add condition rules linking TIA and DVT to patent_foramen_ovale,"Replace or supplement the final diagnosis rule so that 'condition(transient_ischemic_attack, patent_foramen_ovale)' and 'condition(deep_vein_thrombosis, patent_foramen_ovale)' are explicitly asserted, and the diagnosis rule concludes 'patent_foramen_ovale' instead of 'embolic_cardiac_abnormality'.","The medical answer to the problem is Patent Foramen Ovale (PFO). A DVT clot can pass through a PFO (paradoxical embolism) and cause a stroke/TIA in the left-sided motor cortex. The code currently uses the vague term 'embolic_cardiac_abnormality' and lacks the condition facts needed to fire the diagnosis rule, so the specific cardiac abnormality PFO must be named and properly linked.",missing inference rule,30
0,Fix the diagnosis rule to derive the conclusion from patient symptoms rather than missing condition-to-condition links,"Rewrite the diagnosis rule to first check that the patient has all relevant symptoms, derive the intermediate conditions (DVT and TIA/stroke), and then conclude 'patent_foramen_ovale'. For example: 'cardiac_abnormality(Patient, patent_foramen_ovale) :- symptom(Patient, swollen_tender_right_lower_leg), symptom(Patient, recent_long_distance_travel), condition(swollen_tender_right_lower_leg, deep_vein_thrombosis), symptom(Patient, sudden_weakness_left_arm), symptom(Patient, sudden_weakness_left_leg), condition(sudden_weakness_left_arm, stroke_or_tia).'","The current diagnosis rule calls 'condition(transient_ischemic_attack, X)' and 'condition(deep_vein_thrombosis, X)', but no such facts exist in the knowledge base (condition facts map symptoms to conditions, not conditions to cardiac abnormalities). The rule will therefore always fail. The rule must be restructured to follow the actual chain of inference present in the fact base.",missing inference rule,30
0,Rename condition conclusion from 'transient_ischemic_attack' to 'stroke_or_tia' and add paradoxical embolism link,"Add a rule 'paradoxical_embolism :- condition(_, deep_vein_thrombosis), condition(_, stroke_or_tia).' and a final rule 'cardiac_abnormality(patent_foramen_ovale) :- paradoxical_embolism.' to make the reasoning chain explicit and medically accurate.",The clinical scenario describes paradoxical embolism: a venous thrombus (DVT) crossing from the right to left heart through a PFO and causing an arterial embolic event (stroke/TIA). Making this intermediate step explicit in Prolog mirrors the actual diagnostic reasoning and produces the correct specific cardiac abnormality: Patent Foramen Ovale.,missing inference rule,30
2,Fix condition facts to use atoms instead of compound terms,"Change condition facts from using compound terms like condition(urinary_incontinence, symptom(involuntary_urine_loss_during_activity)) and condition(stress_incontinence, condition(urinary_incontinence)) to use plain atoms as second arguments: condition(urinary_incontinence, involuntary_urine_loss_during_activity) and condition(stress_incontinence, urinary_incontinence).","The condition facts use compound terms as second arguments (e.g., symptom(...), condition(...)), but the diagnosis rule queries them with plain atoms (e.g., condition(stress_incontinence, urinary_incontinence)). This mismatch causes the rule to fail to unify correctly.",wrong argument structure,16
2,Fix condition facts for cystometry findings,"Change condition(normal_residual_volume, condition(stress_incontinence)) and condition(normal_detrusor_contraction, condition(stress_incontinence)) to condition(normal_residual_volume, stress_incontinence) and condition(normal_detrusor_contraction, stress_incontinence).","Same issue as above: the second argument uses a compound term condition(stress_incontinence) instead of the plain atom stress_incontinence, causing unification failure in the diagnosis rule.",wrong argument structure,16
2,Add absence of detrusor overactivity as a cystometry finding,"Add a fact condition(no_detrusor_overactivity, stress_incontinence) and include it in the diagnosis rule, and add a symptom or finding no_involuntary_detrusor_contractions to represent the cystometry result.","The key cystometry finding in stress incontinence is the absence of involuntary detrusor contractions (no detrusor overactivity), which distinguishes it from urge incontinence. This should be explicitly represented as a finding.",missing inference rule,30
2,Fix the Q-tip test symptom to correct anatomical finding,"Replace symptom(weak_coccygeal_muscles) with symptom(urethral_hypermobility), as the Q-tip test measures urethral hypermobility (angle > 30 degrees from horizontal), not coccygeal muscle weakness.","The Q-tip (cotton swab) test assesses urethral hypermobility by measuring the angle of urethral rotation. A positive test (angle > 30 degrees) indicates urethral hypermobility, which is characteristic of stress incontinence. Coccygeal muscles are not what this test evaluates.",wrong symptom mapping,12
2,Add a result output to the diagnosis rule,"Modify the diagnosis rule to bind X to a meaningful result such as cystometry_findings(normal_residual_volume, no_involuntary_detrusor_contractions) and add a write/print statement or return value so the query produces an informative answer.","The current diagnosis rule takes an argument X but never binds it to anything, so querying diagnosis(X) would succeed but X remains unbound, providing no useful output about the cystometry findings.",missing output binding,3
3,Correct the diagnosis to Wilson's Disease or Cerebellar Degeneration,"Change the diagnosis from 'wernicke_korsakoff_syndrome' to 'cerebellar_degeneration' or 'wilsons_disease'. The clinical presentation of dysarthria, shuffling gait, and intention tremors in a 45-year-old with a history of alcohol use but 10 years of abstinence is more consistent with cerebellar degeneration (alcoholic cerebellar degeneration) rather than Wernicke-Korsakoff syndrome. Wernicke-Korsakoff typically presents with ophthalmoplegia, ataxia, and confusion/memory loss, not intention tremors specifically.","Wernicke-Korsakoff syndrome presents with the classic triad of ophthalmoplegia, ataxia, and confusion/amnesia. The described symptoms (intention tremor, shuffling gait, dysarthria) are hallmarks of cerebellar dysfunction, most likely alcoholic cerebellar degeneration given the history.",wrong diagnosis,4
3,Add correct symptom facts for the diagnosis,"Add or modify symptom facts to reflect cerebellar signs. Include facts such as 'symptom(cerebellar_ataxia)' and ensure the rule correctly maps intention tremor, dysarthria, and shuffling gait to cerebellar syndrome rather than Wernicke-Korsakoff.","The symptom set (intention tremor, dysarthria, shuffling gait) maps to cerebellar dysfunction, not to Wernicke-Korsakoff syndrome. The facts and rules must reflect the correct pathophysiology.",wrong diagnosis,4
3,Fix rule1 syntax - remove unused variable binding,"The rule1 predicate has a malformed structure. It should be rewritten as a proper Prolog rule: 'symptoms_match :- symptom(dysarthria), symptom(shuffling_gait), symptom(intention_tremor).' instead of using the current nested term structure with 'rule1(symptoms_match(Symptoms), Body)'.","The current syntax 'rule1(symptoms_match(Symptoms), (symptom(dysarthria),...))' does not execute the body as a goal; it just unifies terms. This means the rule never actually checks the symptoms database dynamically.",malformed rule structure,11
3,Fix rule2 syntax - remove unused variable binding,"Similarly, rule2 should be rewritten as: 'history_match :- condition(alcohol_history), condition(abstinence_10_years).' to properly evaluate the conditions as Prolog goals.","The current syntax for rule2 has the same structural problem as rule1 — the body is passed as a term argument rather than being executed, so conditions are never actually queried.",unused variable binding,3
3,Update diagnosis rule to call corrected helper rules,"Update the diagnosis rule to call the corrected predicate names: 'diagnosis(cerebellar_degeneration) :- symptoms_match, history_match.' This ensures both symptom and history checks are properly evaluated.","After fixing rule1 and rule2 into proper Prolog predicates, the diagnosis rule must be updated to call them correctly and reflect the accurate diagnosis.",missing inference rule,30
3,Add abstinence duration as a distinguishing factor,Add a specific rule that notes 10 years of abstinence makes acute Wernicke-Korsakoff less likely and supports a chronic degenerative process. Add a fact like 'abstinence_duration(10)' and incorporate it into the diagnostic reasoning to favor cerebellar degeneration.,The 10-year abstinence period is clinically significant. It makes an acute thiamine-deficiency syndrome (Wernicke's) less likely and supports a chronic degenerative etiology such as alcoholic cerebellar degeneration.,missing inference rule,30
4,Add hallucinations as a distinguishing symptom for Lewy Body Dementia,"Add a separate condition rule for Lewy Body Dementia (DLB) that includes hallucinations, memory issues, wide-based gait, blank facial expression, resting tremor, and bradykinesia, distinguishing it from classic Parkinson's Disease.","The combination of parkinsonism symptoms (resting tremor, bradykinesia) WITH hallucinations and memory issues is more characteristic of Dementia with Lewy Bodies (DLB) than classic Parkinson's Disease. The condition rule should reflect this distinction.",missing inference rule,30
4,Update condition rule to include all presented symptoms,"Modify the condition rule to require symptom(hallucinations), symptom(memory_issues), symptom(gait_wide_based), and symptom(facial_expression_blank) in addition to the tremor and bradykinesia for a more accurate diagnosis of Lewy Body Dementia.","The current condition rule only checks for resting tremor and bradykinesia, ignoring the other clinically significant symptoms. All symptoms should be incorporated to reach the correct diagnosis.",missing inference rule,30
4,Rename condition from parkinsons_disease to lewy_body_dementia,Change condition(parkinsons_disease) to condition(lewy_body_dementia) to accurately reflect the diagnosis suggested by the full symptom profile.,The presence of hallucinations and memory issues alongside parkinsonism features points to Dementia with Lewy Bodies rather than classic Parkinson's Disease. The condition name should match the correct diagnosis.,wrong diagnosis,4
4,Update histological finding to specify cortical and brainstem Lewy bodies,Change diagnosis(histological_specimen_lewy_bodies) to diagnosis(histological_specimen_cortical_and_brainstem_lewy_bodies) and link it to condition(lewy_body_dementia).,"In Dementia with Lewy Bodies, Lewy bodies are found in both the cortex (explaining cognitive and psychiatric symptoms) and the brainstem (explaining parkinsonism). This is more specific and accurate than simply stating 'lewy_bodies'.",wrong diagnosis,4
4,Add alpha-synuclein composition fact for Lewy bodies,Add a fact lewy_body_composition(alpha_synuclein) and a rule that links the histological finding to its protein composition.,"Lewy bodies are composed of aggregated alpha-synuclein protein. Including this fact makes the knowledge base more complete and medically accurate, as the histological hallmark is specifically alpha-synuclein-positive intracytoplasmic inclusions.",missing knowledge base fact,6
5,Rename condition from topham_phenomenon to pustular_psoriasis,"Replace 'topham_phenomenon' with 'pustular_psoriasis' in the condition fact: change 'condition(topham_phenomenon, causes(generalized_pustules))' to 'condition(pustular_psoriasis, causes(generalized_pustules))'.",The correct medical diagnosis for generalized pustules following systemic steroid withdrawal in a psoriasis patient is 'Pustular Psoriasis' (specifically Von Zumbusch type). There is no recognized medical phenomenon called 'topham_phenomenon' associated with this presentation.,wrong diagnosis,4
5,Add steroid withdrawal as a triggering mechanism,"Add a new fact 'condition(pustular_psoriasis, triggered_by(steroid_withdrawal))' to explicitly represent that pustular psoriasis is triggered by discontinuation of systemic steroids.",The key pathophysiological mechanism in this case is that withdrawal of systemic steroids triggers the conversion of plaque psoriasis to pustular psoriasis. This causal link should be explicitly represented in the knowledge base.,missing inference rule,30
5,Update diagnosis rule to return the condition name,"Modify the diagnosis rule to output the actual diagnosis name, e.g.: 'diagnosis(X, pustular_psoriasis) :- patient(X, has_psoriasis), patient(X, treated_with(systemic_steroids)), patient(X, discontinued_treatment), symptom(X, generalized_pustules), condition(pustular_psoriasis, causes(generalized_pustules)), condition(pustular_psoriasis, triggered_by(steroid_withdrawal))'.","The current diagnosis rule only returns the patient identifier but does not specify what the diagnosis actually is. Adding the diagnosis name as a second argument makes the rule informative and medically meaningful, clearly stating that the diagnosis is pustular psoriasis.",missing diagnosis output argument,4
5,Add steroid withdrawal as a patient fact,"Change or supplement 'patient(p1, discontinued_treatment)' with 'patient(p1, steroid_withdrawal)' to more precisely describe the clinical event.","The clinical event is specifically steroid withdrawal, not just generic treatment discontinuation. This more precise fact allows the diagnosis rule to correctly match the triggering condition of pustular psoriasis caused by steroid withdrawal.",missing specific clinical fact,0
6,Fix incorrect patient weight fact,"Change patient(john_doe, 70) to patient(john_doe, weight(70)) or add a separate predicate weight(john_doe, 70). A 2-year-old child weighing 70 kg is clinically abnormal (normal is ~12-14 kg), which is a critical diagnostic clue pointing to obesity-related hip conditions. The weight should be stored distinctly from age.","The current code stores age and weight as identical predicate structures patient(john_doe, 2) and patient(john_doe, 70), making them indistinguishable. More importantly, the abnormal weight (70 kg for a 2-year-old) is a key diagnostic factor that must be represented and used in the diagnosis rule.",wrong fact structure,7
6,Fix typo in symptom predicate for Scarpa's triangle,"Change symptom(john_doe, tenderness_in_scalpas_triangle) to symptom(john_doe, tenderness_in_scarpas_triangle), and correspondingly fix condition(tenderness_in_scalpas_triangle, ...) to condition(tenderness_in_scarpas_triangle, ...).","The anatomical landmark is 'Scarpa's triangle', not 'Scalpa's triangle'. This typo would cause a mismatch between the symptom fact and any condition lookup referencing the correct spelling.",typo in predicate name,1
6,Fix incorrect diagnosis to Septic Arthritis of Hip,"Change all condition facts from hip_impingement to septic_arthritis_of_hip. The correct diagnosis for a 2-year-old presenting with limitation of abduction and internal rotation, tenderness in Scarpa's triangle, and abduction of the limb upon flexing the hip is Septic Arthritis of the Hip (or Perthes disease as secondary consideration), not hip impingement.","Hip impingement (FAI) is not a typical diagnosis for a 2-year-old. The combination of symptoms — limitation of abduction/internal rotation, Scarpa's triangle tenderness, and the limb posturing in abduction on hip flexion — are classic signs of Septic Arthritis of the Hip in a toddler.",wrong diagnosis,4
6,Fix broken diagnosis rule logic,"Rewrite the diagnosis rule to correctly chain patient -> symptom -> condition: diagnosis(Patient, Disease) :- patient(Patient, age(Age)), symptom(Patient, Symptom), condition(Symptom, Disease).","The current rule uses unrelated variables (X, Y, Z, W) that do not correctly link the patient to their symptoms and then to a condition. The variable bindings are reversed and disconnected, meaning the rule would never correctly derive a diagnosis for a specific patient.",wrong variable bindings,3
6,Add age fact with proper structure,"Change patient(john_doe, 2) to patient(john_doe, age(2)) and patient(john_doe, 70) to patient(john_doe, weight(70)) to semantically distinguish age from weight.",Using structured terms age(2) and weight(70) makes the facts semantically meaningful and allows the diagnosis rule to explicitly check for age-appropriate conditions and abnormal weight as diagnostic criteria.,ambiguous fact structure,7
8,Fix unbound variable in symptom facts,"Replace symptom(patient(X), ...) facts with a concrete patient identifier, e.g., symptom(patient(john), decreased_facial_hair). The variable X in the facts is unbound and acts as a wildcard, which is not meaningful as a fact declaration.","In Prolog, variables in facts are universally quantified, meaning symptom(patient(X), decreased_facial_hair) would match any patient, which is not the intended behavior. A specific patient atom should be used, e.g., patient1 or john.",singleton variable,31
8,Add patient fact,"Add a fact defining the patient, e.g., patient(patient1), so that the diagnosis rule can correctly reference and instantiate the patient.","The diagnosis rule calls patient(X), but there is no patient/1 fact defined anywhere in the program. Without this fact, the diagnosis rule will always fail.",missing patient fact,0
8,Fix diagnosis rule to return the condition name,"Modify the diagnosis rule to also return the condition K that matches all symptoms, e.g., diagnosis(X, K) :- patient(X), condition(K, decreased_facial_hair), condition(K, bilateral_breast_enlargement), ... so the diagnosed condition is part of the output.","The current diagnosis rule only checks if a patient exists and a condition matches, but does not expose which condition was diagnosed. Returning K allows the caller to know the diagnosis is klinefelter_syndrome.",missing output variable,22
8,Add karyotype fact for Klinefelter syndrome,"Add a fact linking Klinefelter syndrome to its karyotype, e.g., karyotype(klinefelter_syndrome, '47,XXY').","The medical problem asks for the karyotype associated with the diagnosis. The program currently has no representation of karyotypes, so it cannot answer the actual question being asked.",missing fact,6
8,Add karyotype query rule,"Add a rule that combines diagnosis and karyotype lookup, e.g., patient_karyotype(X, Karyotype) :- diagnosis(X, Condition), karyotype(Condition, Karyotype).","To fully solve the medical problem, the program needs a rule that retrieves the karyotype for the diagnosed condition, which is the final answer expected (47,XXY for Klinefelter syndrome).",missing inference rule,30
9,Fix chest_xray_pattern rule dependency,"Update the chest_xray_pattern rule to directly reference the condition fact: chest_xray_pattern :- condition(pneumonia, chest_xray_pattern), symptom(johnson_child, pneumonia).","The current rule derives chest_xray_pattern only from patient and symptom facts, but it should also verify the condition/2 fact that links pneumonia to chest_xray_pattern to maintain logical consistency with the knowledge base.",missing inference rule,30
9,Fix bacterial_infection rule to call chest_xray_pattern correctly,"Update the bacterial_infection rule to: bacterial_infection :- chest_xray_pattern, condition(bacterial_infection, common_bacterial_pneumonia).","The rule should first confirm chest_xray_pattern holds and then verify the condition fact linking bacterial_infection to common_bacterial_pneumonia, ensuring the inference chain is properly connected.",wrong predicate call order,1
9,Fix common_bacterial_pneumonia rule,"Update the common_bacterial_pneumonia rule to: common_bacterial_pneumonia :- bacterial_infection, condition(streptococcus_pneumoniae, typical_presentations).","The rule currently references condition(bacterial_infection, common_bacterial_pneumonia) which creates a circular dependency. It should confirm bacterial_infection holds and then check the condition linking streptococcus_pneumoniae to typical_presentations.",circular dependency in rule,11
9,Fix typical_presentations rule,"Update the typical_presentations rule to: typical_presentations :- common_bacterial_pneumonia, condition(streptococcus_pneumoniae, typical_presentations).","The rule should depend on common_bacterial_pneumonia being established first and then verify the condition fact for streptococcus_pneumoniae, properly closing the inference chain toward the final diagnosis.",missing inference rule,30
9,Add missing condition fact linking common_bacterial_pneumonia to typical_presentations,"Add the fact: condition(common_bacterial_pneumonia, typical_presentations).","There is no condition/2 fact connecting common_bacterial_pneumonia to typical_presentations, which breaks the inference chain. The existing fact condition(streptococcus_pneumoniae, typical_presentations) skips an intermediate step that should be explicitly represented.",missing inference rule,30
9,Add explanatory comment and query example,Add a comment at the bottom of the program showing how to query the diagnosis: % Query: ?- diagnosis(Organism). % Expected result: Organism = streptococcus_pneumoniae.,"Without a clear query example, it is not obvious how to invoke the diagnosis rule and verify that streptococcus_pneumoniae is correctly returned as the most likely causative organism.",missing usage documentation,8
11,Correct Disease Identification,"Replace 'huntingtons_disease' with 'friedreichs_ataxia' throughout the program. GAA trinucleotide repeat expansions are characteristic of Friedreich's Ataxia, not Huntington's Disease (which involves CAG repeats).","Huntington's Disease is caused by CAG trinucleotide repeats on chromosome 4, whereas GAA trinucleotide repeat expansions are the hallmark of Friedreich's Ataxia. The medical problem explicitly states GAA repeats.",wrong diagnosis,4
11,Correct Chromosome Association,"Add a fact 'chromosome(friedreichs_ataxia, 9)' and a rule linking the diagnosis to chromosome 9, replacing any reference to chromosome 12.","Friedreich's Ataxia is caused by mutations in the FXN gene located on chromosome 9 (9q21.11), not chromosome 12. The program must reflect the correct chromosomal location.",wrong chromosome fact,17
11,Fix Circular/Incorrect Rule for GAA Expansion,"Remove the circular rule 'condition(patient(X), trinucleotide_repeat_expansion(gaa)) :- condition(patient(X), huntingtons_disease)' and replace it with a proper rule: 'condition(patient(X), friedreichs_ataxia) :- symptom(patient(X), gait_disturbances), symptom(patient(X), tremors), symptom(patient(X), speech_difficulties), condition(patient(X), trinucleotide_repeat_expansion(gaa))'.",The original rule is logically circular and incorrectly links GAA expansions to Huntington's Disease. The corrected rule properly derives Friedreich's Ataxia from the combination of symptoms and GAA repeat expansion.,wrong diagnosis,4
11,Fix Diagnosis Fact,"Replace 'diagnosis(huntingtons_disease)' with 'diagnosis(friedreichs_ataxia)' and add a rule 'diagnosis(friedreichs_ataxia) :- condition(patient(_), friedreichs_ataxia), chromosome(friedreichs_ataxia, 9)'.",The diagnosis fact must reflect the correct disease (Friedreich's Ataxia) and should be derived from the condition and chromosome facts rather than being a standalone unsupported fact.,wrong diagnosis,4
11,Fix Unbound Variable in Facts,"Replace 'symptom(patient(X), ...)' and 'condition(patient(X), ...)' facts (where X is unbound) with a specific patient identifier, e.g., 'symptom(patient(p1), gait_disturbances)' or use a general predicate without the patient wrapper for generic rules.",Using an unbound variable X in facts is syntactically problematic in Prolog; facts should use ground terms or be restructured as rules with proper variable scoping.,unbound variable in facts,18
13,Update ECG finding to Mobitz Type I (Wenckebach),"Change 'symptom(ecg_first_degree_av_block, true)' to 'symptom(ecg_second_degree_av_block_mobitz_type1, true)' to reflect the correct ECG finding for this patient profile.","A well-trained marathon runner (athlete) commonly exhibits increased vagal tone, which predisposes to Mobitz Type I (Wenckebach) second-degree AV block. This is a benign, physiological finding in endurance athletes, not a first-degree AV block. The ECG in this context would show progressive PR interval prolongation followed by a dropped QRS complex.",wrong diagnosis,4
13,Update diagnosis rule to reflect Mobitz Type I AV block,"Change the diagnosis rule to check for 'symptom(ecg_second_degree_av_block_mobitz_type1, true)' and set X = 'second_degree_av_block_mobitz_type1' (Wenckebach) instead of 'first_degree_av_block'.","The diagnosis conclusion must match the updated ECG finding. The correct diagnosis for an asymptomatic endurance athlete with increased vagal tone is Mobitz Type I (Wenckebach) second-degree AV block, not first-degree AV block.",wrong diagnosis,4
