question_index,fix_name,fix_description,reason,tag,tag_cluster
33,Add Nikolsky sign representation,"Rename or add a clarifying comment that bullae_spread_under_pressure corresponds to a positive Nikolsky sign, and ensure this is used in the condition rule for pemphigus vulgaris.","The spreading of bullae under lateral pressure is the Nikolsky sign, a hallmark of pemphigus vulgaris. Making this explicit improves the medical accuracy and clarity of the knowledge base.",missing symptom representation,12
34,Fix condition rule signature,"Change the condition rule to use a plain variable for the patient instead of a compound term. Replace 'condition(rheumatoid_arthritis, patient(P))' with 'condition(rheumatoid_arthritis, P)'.","The second argument of the condition predicate is written as 'patient(P)', which is a compound term, not a variable. This means the rule will never unify correctly when called from the diagnosis rule with a plain atom. It should simply be 'P' so that the patient identifier can be passed and used in the symptom checks.",wrong argument structure,16
34,Fix diagnosis rule to pass correct patient,"Change the diagnosis rule so it calls condition with a specific patient, e.g., 'condition(RA, jane)', or uses a variable that is properly bound, and simplify the unification: 'diagnosis(rheumatoid_arthritis) :- condition(rheumatoid_arthritis, jane).'","The current diagnosis rule calls 'condition(RA, Patient)' but 'Patient' is never bound to an actual patient identifier, so the condition rule cannot look up symptoms. The patient must be bound (e.g., 'jane') for the symptom lookups to succeed.",unbound variable in rule,18
34,Add pathogenesis fact for rheumatoid arthritis,"Add a fact 'pathogenesis(rheumatoid_arthritis, production_of_antibodies_against_antibodies).' and a rule 'answer(Pathogenesis) :- diagnosis(Disease), pathogenesis(Disease, Pathogenesis).'","The program diagnoses rheumatoid arthritis but never maps the diagnosis to its pathogenesis, which is the actual question being asked. Rheumatoid arthritis is characterised by the production of rheumatoid factor (antibodies against IgG antibodies), corresponding to answer choice C. Without this fact and rule, the program does not solve the medical problem.",missing inference rule,30
34,Simplify redundant unification in diagnosis rule,"Remove the redundant unification 'RA = rheumatoid_arthritis' by directly using the atom in the call: 'diagnosis(rheumatoid_arthritis) :- condition(rheumatoid_arthritis, jane).'",Using a variable RA and then unifying it with the atom is unnecessarily indirect and error-prone. Directly using the atom makes the rule cleaner and avoids potential unification issues.,redundant variable unification,5
37,Fix diagnosis predicate to return meaningful result,"The diagnosis/1 predicate has an unbound variable X that is never unified with anything. It should be changed to diagnosis(P, Conditions) or the head should clearly state what is being diagnosed, e.g., diagnosis(P, [estrogen_levels_normal, endometrium_responsive, pituitary_functional]) so the result is actually returned and usable.","The variable X in diagnosis(X) is never assigned a value inside the rule body, making the predicate useless for returning diagnostic conclusions. The predicate should bind X (or a named variable) to the list of inferred conditions.",unbound variable in predicate head,18
37,Add direct linkage between patient/symptom and inferred conditions,"The rule body calls condition/2 facts independently without linking them to the patient P. The inferred conditions (estrogen_levels_normal, endometrium_responsive, pituitary_functional) should be explicitly asserted or derived as conclusions tied to the patient, e.g., inferred(P, estrogen_levels_normal), inferred(P, endometrium_responsive), inferred(P, pituitary_functional) as part of the rule.",The current code checks that condition facts exist globally but never associates them with the specific patient who has the symptom. The logic should derive patient-specific conclusions.,missing patient variable binding,3
37,Replace condition/2 facts with implication rules,"Instead of using condition/2 as static facts, rewrite them as rules that are triggered by the presence of bleeding_after_progesterone. For example: estrogen_level(P, normal) :- patient(P, amenorrhea), symptom(P, bleeding_after_progesterone). Similarly for endometrial_status and pituitary_axis.","The medical logic is that bleeding after progesterone IMPLIES adequate estrogen, responsive endometrium, and functional pituitary axis. These should be derived conclusions (rules), not pre-existing facts, so the program actually performs inference rather than just checking pre-asserted facts.",missing inference rule,30
37,Add a query or explanation predicate,"Add a predicate such as explain_diagnosis(P) that prints or returns the meaning of each inferred condition, e.g., explaining that normal estrogen means the endometrium was primed, responsive endometrium means it reacted to progesterone withdrawal, and functional pituitary axis means the outflow tract and uterus are intact.",The program currently has no way to communicate the clinical interpretation of the diagnosis. An explanation predicate would make the program actually solve and communicate the medical problem as stated.,missing explanation output,22
37,Correct the pituitary_axis conclusion to outflow tract intact,"The conclusion pituitary_axis(functional) should be split or clarified: bleeding after progesterone primarily confirms that the outflow tract is patent and the uterus/endometrium is functional. The pituitary-ovarian axis being functional is a separate and not fully confirmed conclusion from this test alone. The fact should be renamed or scoped correctly, e.g., outflow_tract(P, patent) and uterus(P, functional).","Medically, a positive progesterone withdrawal test confirms adequate estrogen priming, a responsive endometrium, and a patent outflow tract — not necessarily full pituitary axis functionality. Mislabeling this misleads the diagnostic inference.",wrong diagnosis,4
38,Correct substance from psilocybin_mushrooms to cocaine,Replace all instances of 'psilocybin_mushrooms' with 'cocaine' in the condition facts,"The symptoms described (delusions, auditory and visual hallucinations, and formication - the sensation of insects crawling or grains of sand on the skin, known as 'cocaine bugs' or Magnan's sign) are classic signs of cocaine addiction/toxicity, not psilocybin mushroom use. Formication (tactile hallucinations) is a hallmark symptom of cocaine abuse.",wrong substance assignment,37
38,Fix symptom facts to bind to a specific substance variable,"Change the symptom facts to properly associate symptoms with a substance, e.g., symptom(delusions, cocaine), symptom(hallucinations_sight_hearing, cocaine), symptom(creeping_grains_skin, cocaine)",The current symptom facts use an unbound variable X which makes them trivially true for any input. They should be grounded to the specific substance being diagnosed.,unbound variable in facts,18
38,Fix diagnosis rule to return the substance name,"Update the diagnosis rule to return the identified substance Y: diagnosis(Substance) :- condition(Substance, delusions), condition(Substance, hallucinations_sight_hearing), condition(Substance, creeping_grains_skin).",The current rule does not properly unify and return the diagnosed substance. The rule should directly match all three conditions to a single substance and return it as the diagnosis result.,missing unification in rule,11
39,Add missing histrionic symptoms,"Add 'attention_seeking' and 'seductive_behavior' as symptoms for jane, since the patient wears a revealing dress (seductive behavior) and seeks attention through self-harm and dramatic presentations.","The condition rule for histrionic requires 'attention_seeking' and 'seductive_behavior' symptoms, but these are not listed as symptoms for jane, making the differential incomplete.",missing symptom facts,12
39,Fix diagnosis rule to link patient symptoms,"Rewrite the diagnosis rule to check that the patient actually has the required symptoms via symptom(Patient, S) facts, rather than just checking if the symptoms exist in the condition list abstractly. For example: diagnosis(Patient, Condition) :- condition(Condition, RequiredSymptoms), maplist(symptom(Patient), RequiredSymptoms).","The current diagnosis rule does not reference the patient at all and only checks the condition/2 fact internally, meaning it never validates whether the patient actually has those symptoms. It will always succeed for borderline regardless of the patient's actual recorded symptoms.",missing patient symptom check,12
39,Add a best_diagnosis rule that selects borderline over histrionic,"Add a rule that counts matching symptoms per condition and selects the condition with the most matches, or add explicit priority logic that identifies borderline as the primary diagnosis when self_harm and fear_of_abandonment are both present, distinguishing it from histrionic.","Both borderline and histrionic may partially match, but the key distinguishing features here are self-harm, fear of abandonment, and unstable relationships, which are hallmarks of borderline personality disorder. The program needs logic to select the most likely diagnosis rather than returning any match.",missing diagnosis prioritization,29
39,Add paranoid ideation symptom for jane,"Add symptom(jane, paranoid_ideation) to reflect the patient's unfounded belief that her husband was having sexual thoughts about another woman, which is a recognized feature of borderline personality disorder.","The patient's conviction that her husband was having sexual thoughts about another woman without clear evidence reflects transient paranoid ideation, a DSM criterion for borderline personality disorder that is currently not captured in the symptom facts.",missing symptom fact,12
39,Update borderline condition criteria to include more DSM symptoms,"Expand the condition(borderline, ...) fact to include additional DSM-5 criteria such as paranoid_ideation, impulsivity, and unstable_relationships: condition(borderline, [self_harm, emotional_lability, fear_of_abandonment, impulsivity, unstable_relationships, paranoid_ideation]).","The current borderline condition only lists three symptoms, which is insufficient to represent the DSM-5 criteria and to clearly differentiate borderline from other personality disorders in the diagnostic logic.",incomplete diagnostic criteria,4
40,Fix patient fact representation,"Change 'patient(50, male).' to use a consistent identifier. The patient fact should be 'patient(john, 50, male, diabetic).' or at minimum 'patient(patient1, 50, male).' so that the patient can be referenced by an identifier rather than by age.","The current 'patient(50, male).' fact uses age as the first argument, but 'symptom(poor_urinary_stream, X) :- patient(X, _).' tries to unify X with the first argument of patient (which would be 50, a number, not a meaningful patient identifier). This causes inconsistency in how the patient is referenced throughout the program.",inconsistent patient identifier,13
40,Add diabetes as a patient condition,"Add a fact 'has_condition(patient1, diabetes).' or extend the patient fact to include diabetes history, e.g., 'patient(patient1, 50, male, diabetic).' to represent the long history of diabetes mentioned in the problem.","The medical problem explicitly states the patient has a long history of diabetes, which is a relevant clinical detail. Diabetes can cause diabetic cystopathy (neurogenic bladder), which is actually the most likely diagnosis given the context. This fact is completely missing from the Prolog representation.",missing patient data fact,0
40,Change diagnosis to diabetic cystopathy (neurogenic bladder),"Add condition facts for 'diabetic_cystopathy' (also known as neurogenic bladder) mapping to all four symptoms, and update or add a diagnosis rule that considers the patient's diabetes history to conclude 'diabetic_cystopathy' as the primary diagnosis.","In a 50-year-old diabetic patient, the most likely cause of poor urinary stream, hesitancy, difficulty in micturition, and incomplete voiding is diabetic cystopathy (neurogenic bladder due to autonomic neuropathy), not benign prostatic hyperplasia (BPH). The diabetes history is the key differentiating factor that should drive the diagnosis.",wrong diagnosis,4
40,Fix diagnosis rule to use distinct symptom variables,"Ensure the four symptom variables (Symptom1, Symptom2, Symptom3, Symptom4) in the diagnosis rule are constrained to be different from each other using 'Symptom1 \= Symptom2', etc., or rewrite the rule to explicitly list the required symptoms.","Without distinctness constraints, Prolog may unify all four symptom variables to the same symptom (e.g., all four become 'poor_urinary_stream'), producing redundant or incorrect diagnoses. The rule should ensure all four distinct symptoms are matched.",duplicate variable unification,5
40,Add diabetes-aware diagnosis rule,"Add a specific diagnosis rule: 'diagnosis(diabetic_cystopathy) :- patient(Patient, _, male), has_condition(Patient, diabetes), symptom(poor_urinary_stream, Patient), symptom(hesitancy, Patient), symptom(difficulty_in_micturition, Patient), symptom(incomplete_voiding, Patient).' to capture the diabetes-driven diagnosis.","The diagnosis should incorporate the patient's diabetic history as a key criterion. A rule that checks for both the urinary symptoms and the presence of diabetes will correctly identify diabetic cystopathy as the most likely condition, which is the medically correct answer for this clinical scenario.",missing inference rule,30
41,Add onset time fact,"Add a fact representing the rapid onset of symptoms (within 3 hours after food consumption), e.g., onset_time(john, 3, hours).","The rapid onset (within 1-6 hours) is a critical clinical clue that distinguishes Staphylococcus aureus food poisoning (preformed toxin) from other causes. Without this fact, the program ignores the most important diagnostic criterion.",missing clinical fact,0
41,Add food exposure context fact,"Add a fact representing the food exposure at a party, e.g., food_exposure(john, party).",The context of consuming food at a social gathering is relevant epidemiological information that should be represented as a fact to support the diagnosis of food poisoning.,missing context fact,6
41,Fix the condition chain to directly link vomiting to Staphylococcus aureus,"Replace the multi-step condition chain with a direct rule that links rapid-onset vomiting after food exposure to Staphylococcus aureus, e.g., condition(rapid_onset_vomiting_after_food, staphylococcus_aureus).",The current chain (vomiting -> gastroenteritis -> bacterial_infection -> staphylococcus_aureus -> food_poisoning) is logically inverted and overly indirect. The diagnosis should map the combination of symptoms and context directly to the causative organism.,missing inference rule,30
41,Fix the diagnosis rule to incorporate onset time and food exposure,"Update the diagnosis rule to use onset_time and food_exposure facts alongside the symptom, and have it conclude with the causative organism (staphylococcus_aureus) rather than an intermediate condition. For example: diagnosis(staphylococcus_aureus) :- patient(john, _), symptom(john, vomiting), onset_time(john, Hours, hours), Hours =< 6, food_exposure(john, _).","The current diagnosis rule only matches vomiting to gastroenteritis, which is too generic. The rule must incorporate the rapid onset time and food exposure context to correctly identify Staphylococcus aureus as the most likely organism responsible.",missing inference rule,30
41,Add a fact clarifying the mechanism as preformed toxin,"Add a fact such as mechanism(staphylococcus_aureus, preformed_toxin) to represent that S. aureus causes illness via a preformed heat-stable enterotoxin.",The preformed toxin mechanism explains why symptoms appear so rapidly (1-6 hours). Including this fact makes the knowledge base medically accurate and supports the reasoning for the short incubation period.,missing knowledge base fact,6
43,Correct diagnosis name from migratory_angina to nephrolithiasis,Replace all instances of 'migratory_angina' with 'nephrolithiasis' in the diagnosis rules.,"The patient's presentation (colicky flank/lower quadrant pain, hematuria, history of dehydration from hiking) is classic for kidney stones (nephrolithiasis), not migratory angina, which is a cardiac condition.",wrong diagnosis,4
43,Add hematuria/red urine as a key symptom in the main diagnosis rule,"Include 'symptom(Patient, red_urine)' as a conjunctive condition inside the main diagnosis rule rather than as a separate standalone rule.","Hematuria (red urine) is a cardinal symptom of nephrolithiasis and should be part of the unified diagnostic rule, not a separate rule that independently concludes the same diagnosis.",missing inference rule,30
43,Add dehydration fact linked to hiking trip,"Add a fact such as 'patient(patient(23, male), dehydration)' and a rule linking hiking_trip to dehydration risk, e.g., 'risk_factor(Patient, dehydration) :- patient(Patient, hiking_trip(_))'.",Dehydration from the hiking trip in Colorado is the precipitating factor for kidney stone formation. This causal link should be represented in the knowledge base to properly model the clinical reasoning.,missing inference rule,30
43,Add correct answer mapping to answer choice B (cystinuria),"Add a fact or rule such as 'most_likely_cause(nephrolithiasis, hereditary_defect_amino_acid_transporter)' and a supporting rule explaining that recurrent stones in a young patient suggest cystinuria (answer B).","The correct answer is B: a hereditary defect of the amino acid transporter in the kidney (cystinuria). Recurrent kidney stones in a young patient with hematuria point to cystinuria, and the program should encode this causal explanation.",missing inference rule,30
43,Add recurrent episodes as a diagnostic criterion for cystinuria,"Add a rule that uses 'previous_episodes' symptom combined with young age and nephrolithiasis to suggest cystinuria, e.g., 'diagnosis(cystinuria) :- diagnosis(nephrolithiasis), symptom(patient(Age,_), previous_episodes), Age < 30'.","Recurrent nephrolithiasis in a young patient is a hallmark of cystinuria (hereditary amino acid transporter defect), which is the correct answer. The program must capture this reasoning to arrive at answer B.",missing inference rule,30
43,Remove the standalone red_urine diagnosis rule,"Delete the second 'diagnosis(migratory_angina) :- symptom(Patient, red_urine).' clause as it is both incorrectly named and logically insufficient on its own.",Red urine alone is not sufficient to diagnose any specific condition without other supporting symptoms. This overly broad rule would cause incorrect diagnoses and should be removed or merged into the main rule.,wrong diagnosis,4
44,Replace patent_artery with patent_foramen_ovale,"Change all occurrences of 'patent_artery' to 'patent_foramen_ovale' in the facts and rules, since the condition described (transient right-to-left shunt through the atrial septum during coughing) is a patent foramen ovale (PFO), not a patent artery.","The medical problem describes failure of closure of the atrial septum (foramen ovale), which is patent foramen ovale. Using 'patent_artery' is medically incorrect and misleading.",wrong predicate name,1
44,Replace male_hernia with hypospadias,"Change all occurrences of 'male_hernia' to 'hypospadias' in the facts and rules, including the condition facts and the diagnosis rule.","The medical problem asks about incomplete closure along the genital tubercle in males, which is hypospadias (failure of urethral folds to fuse along the ventral surface of the genital tubercle). Male hernia is not related to the genital tubercle closure process.",wrong diagnosis,4
44,Add third argument to condition facts for hypospadias,"Update the condition facts for hypospadias to include a third argument matching the structure used in similar_conditions rule, e.g.: condition(hypospadias, embryologic_failure, urethral_fold_closure). Also update patent_foramen_ovale facts similarly: condition(patent_foramen_ovale, embryologic_failure, septal_closure).","The similar_conditions rule uses a 3-argument structure (condition(A,B,C)), but the condition facts only have 2 arguments, causing a mismatch and preventing the rule from working correctly.",wrong predicate arity,1
44,Fix the similar_conditions rule to use proper Prolog syntax,"Rewrite similar_conditions to operate on actual condition terms with consistent arity, e.g.: similar_conditions(A, B) :- condition(A, embryologic_failure, _), condition(B, embryologic_failure, _), A \= B.",The current similar_conditions rule uses compound terms as arguments in an inconsistent way and the unification logic is fragile. A cleaner rule directly queries the condition facts for shared embryologic_failure characteristic.,syntax error fix,26
44,Fix the diagnosis rule to correctly derive hypospadias,"Rewrite the diagnosis rule as: diagnosis(hypospadias) :- symptom(john_doe, transient_shunt), symptom(john_doe, atrial_septum), condition(patent_foramen_ovale, embryologic_failure, septal_closure), similar_conditions(patent_foramen_ovale, hypospadias).","The current diagnosis rule uses incorrect condition name (male_hernia), has a flawed unification pattern with 'male_hernia = M', and does not cleanly connect the patient symptoms to the analogous embryologic failure condition.",wrong diagnosis,4
44,Add transient_shunt as a symptom fact for john_doe,"Ensure symptom(john_doe, transient_shunt) is present as a direct fact (it already exists), and update symptom_to_condition rules to reference the correct condition name patent_foramen_ovale instead of patent_artery.",The symptom_to_condition rules reference patent_artery which does not exist after renaming; they must reference patent_foramen_ovale to remain consistent and logically valid.,wrong condition name reference,21
46,Fix invalid Prolog syntax for facts with type annotations,"Remove the invalid pseudo-type annotations 'patient/2:', 'vital_signs/3:', and 'physical_exam/2:' which are not valid Prolog syntax. Replace them with plain Prolog facts: 'vital_signs(patient(58, male), blood_pressure, 150_90).', 'vital_signs(patient(58, male), pulse, 100).', 'physical_exam(patient(58, male), heart_sounds(normal)).', 'physical_exam(patient(58, male), lungs(clear)).'",Prolog does not support type annotation syntax like 'predicate/arity:' followed by facts. These declarations cause syntax errors and prevent the program from loading.,invalid syntax annotations,26
46,Fix mismatched patient term in condition rule,"In the condition rule, change 'condition(patient(Patient), ACS)' to 'condition(Patient, ACS)' and update the symptom calls to use 'Patient' directly (e.g., 'symptom(Patient, retrosternal_chest_pain)'), since the facts use 'patient(58, male)' as the full patient term, not a nested 'patient(Patient)' wrapper.","The condition rule wraps the variable in an extra 'patient()' functor, causing a mismatch with the symptom facts which already use 'patient(58, male)' as the subject. This prevents the rule from ever unifying correctly.",wrong argument structure,16
46,Fix diagnosis rule to return a meaningful answer,"Change 'diagnosis(ECG)' to 'diagnosis(ecg)' (using an atom instead of an unbound variable), so the rule correctly states that ECG is the recommended investigation when ACS is suspected. Also update the condition call to match the fixed condition rule: 'diagnosis(ecg) :- condition(patient(58, male), _).'","Using 'ECG' as an uppercase variable means it is unbound and will unify with anything, not specifically representing the ECG investigation. Using the atom 'ecg' correctly encodes the answer. Additionally, the second argument 'ACS' in the condition call should be an anonymous variable or atom since it is not used in the diagnosis rule body.",atom vs variable confusion,9
46,Add pain_at_rest symptom fact,"Add the fact 'symptom(patient(58, male), pain_at_rest).' to represent that the chest pain started at rest, and optionally incorporate it into the condition rule as an additional criterion for ACS suspicion.","The medical problem explicitly states the pain started at rest, which is a key feature distinguishing unstable angina/NSTEMI from stable angina. This clinically important detail is missing from the facts.",missing symptom fact,12
46,Add explanation comment clarifying ECG as first-line investigation,"Add a comment or an additional rule explaining why ECG is preferred over cardiac troponin as the immediate next step: ECG is rapid, non-invasive, and can immediately identify ST-elevation MI requiring urgent reperfusion, whereas troponin results take time. Example: '% ECG is the immediate first investigation in suspected ACS to identify STEMI for urgent reperfusion therapy.'","The program currently asserts ECG as the answer but provides no reasoning distinguishing it from cardiac troponin (option C), which is also important but takes longer. Adding this clarification makes the program more complete and medically accurate.",missing inference rule,30
48,Rename condition to rampant_caries,Change all occurrences of 'acute_carious_process' to 'rampant_caries' in the condition facts and diagnosis rule.,"The medical term that specifically describes an acute, aggressive carious process involving multiple teeth and multiple surfaces simultaneously is 'rampant caries'. The current code uses the generic descriptor 'acute_carious_process' instead of the correct clinical terminology.",wrong terminology,20
