question_index,fix_name,fix_description,reason,tag,tag_cluster
90,Add ACE inhibitor medication fact,Add a fact such as 'medication(ace_inhibitor).' to represent that the patient is taking an ACE inhibitor for hypertension.,ACE inhibitors are commonly prescribed for hypertension and are a well-known cause of bradykinin-mediated angioedema. This fact is critical to establishing the correct diagnosis and mechanism.,missing medication fact,36
90,Add swelling location facts,Add facts such as 'swelling_location(lips).' and 'swelling_location(tongue).' to represent the physical exam findings.,"The physical exam specifically shows swelling of the lips and tongue, which are hallmark signs of angioedema and are important for distinguishing this condition from others.",missing facts,6
90,Add normal C4 level fact,"Add a fact such as 'lab_result(c4_level, normal).' to represent the normal serum C4 levels.","Normal C4 levels help rule out hereditary angioedema (which involves complement pathway deficiency) and support the diagnosis of ACE inhibitor-induced angioedema, which is bradykinin-mediated and complement-independent.",missing fact,6
90,Add no allergy and no insect bite facts,Add facts such as 'no_allergy.' and 'no_insect_bite.' to represent the absence of allergies and insect bites.,"The absence of allergies and insect bites rules out IgE-mediated (histamine-mediated) allergic angioedema, further supporting the bradykinin-mediated mechanism caused by ACE inhibitor use.",missing negation facts,6
90,Add correct diagnosis rule for ACE inhibitor-induced angioedema,"Add a diagnosis rule: 'diagnosis(ace_inhibitor_induced_angioedema) :- symptom(facial_swelling), swelling_location(lips), swelling_location(tongue), symptom(difficulties_speaking), symptom(difficulties_swallowing), medication(ace_inhibitor), lab_result(c4_level, normal), no_allergy, no_insect_bite.'","This rule correctly captures the clinical scenario where an ACE inhibitor causes angioedema through bradykinin accumulation (ACE normally degrades bradykinin; when inhibited, bradykinin accumulates causing vasodilation and edema). Normal C4 and absence of allergies/insect bites further confirm this mechanism.",missing inference rule,30
90,Add underlying mechanism fact,"Add a fact or rule such as 'mechanism(ace_inhibitor_induced_angioedema, bradykinin_accumulation).' to explicitly represent the underlying mechanism.","The medical question asks for the underlying mechanism, which is bradykinin accumulation due to ACE inhibition. ACE inhibitors block the enzyme that degrades bradykinin, leading to its accumulation and subsequent angioedema. This should be explicitly represented in the Prolog program.",missing inference rule,30
91,Add Patient Variable to Diagnosis Rule,"Introduce the Patient variable in the diagnosis rule head so it becomes diagnosis(Patient, organophosphate_poisoning) and all references to Patient inside the rule body are properly unified.","The current diagnosis rule does not bind the Patient variable in the head, making it impossible to know which patient receives the diagnosis. The rule body uses Patient as a local variable but it is never connected to the conclusion, which is a logical and practical flaw.",missing variable unification,5
91,Add Miosis (Pinpoint Pupils) as a Specific Pupil Finding,"Replace or supplement the generic condition(john_doe, abnormal_pupils) fact with condition(john_doe, miosis) or condition(john_doe, pinpoint_pupils), and update the diagnosis rule to check for condition(Patient, miosis) instead of condition(Patient, abnormal_pupils).",Organophosphate poisoning characteristically causes miosis (pinpoint pupils) due to excessive cholinergic stimulation. Using the specific finding miosis makes the diagnostic rule medically accurate and distinguishes it from other causes of abnormal pupils.,missing specificity in symptom encoding,12
91,Add Cholinergic Symptoms for Completeness,"Add additional characteristic symptoms of organophosphate poisoning as facts, such as symptom(john_doe, excessive_sweating), symptom(john_doe, salivation), or symptom(john_doe, bradycardia), and optionally include them in the diagnosis rule.",Organophosphate poisoning presents with a broader cholinergic toxidrome (SLUDGE/DUMBELS). Including more characteristic symptoms improves diagnostic specificity and better represents the medical problem.,missing symptom facts,12
91,Add Occupational Pesticide Exposure Fact,"Add a more specific fact such as condition(john_doe, pesticide_exposure) or symptom(john_doe, organophosphate_exposure) and reference it in the diagnosis rule, in addition to or instead of the generic farmer_exposure.","The clinical scenario specifically implies exposure to organophosphate pesticides, which are commonly used on farms. Making the exposure explicit improves the precision of the diagnostic reasoning chain.",missing specific fact,6
91,Fix patient/2 Predicate Overloading,"Separate the patient facts into distinct predicates, for example patient_age(john_doe, 40) and patient_occupation(john_doe, farmer), and update all rules that reference patient/2 accordingly.","Using the same predicate patient/2 for both age and occupation mixes different semantic types under one predicate, which can cause unintended unification (e.g., patient(X, farmer) could accidentally unify with patient(X, 40)). Separating them avoids logical errors.",predicate overloading,1
92,Remove SSRIs as the cause of disinterest in food with protein/calorie malnutrition,"Remove the symptoms disinterest_in_food, protein_malnutrition, and calorie_malnutrition from SSRIs and reassign them to diuretics.","SSRIs are not the most likely cause of disinterest in food with protein/calorie malnutrition. Diuretics are the correct answer, as they can lead to anorexia and subsequent protein/calorie malnutrition, especially in elderly patients.",wrong diagnosis,4
92,Add correct symptoms to diuretics,"Add the symptoms disinterest_in_food, protein_malnutrition, and calorie_malnutrition to diuretics, replacing or supplementing the current symptoms.",Diuretics are the most likely medication to cause disinterest in food with protein/calorie malnutrition. The current Prolog code incorrectly assigns these symptoms to SSRIs instead of diuretics.,wrong diagnosis,4
92,Update the diagnosis rule to correctly identify diuretics,"Ensure the diagnosis rule correctly resolves to diuretics when querying for the medication causing disinterest_in_food, protein_malnutrition, and calorie_malnutrition.","The diagnosis rule currently resolves to SSRIs because those symptoms are incorrectly assigned to SSRIs. Once symptoms are reassigned to diuretics, the rule will correctly identify diuretics as the diagnosis.",wrong symptom assignment,12
92,Fix the patient/2 predicate structure,"Replace patient(medication, X) with a more meaningful predicate such as medication(X) to properly represent medications as entities rather than using a generic 'medication' atom as the first argument.","The current use of patient(medication, X) is semantically incorrect. The predicate should represent medications directly, e.g., medication(ssris), medication(diuretics), etc., to make the knowledge base more accurate and readable.",predicate misuse,1
93,Correct associated condition to ANCA vasculitis,"Replace the incorrect conditions (anti_gb3_iga_nephropathy, minimal_change_disease, membranous_nephropathy) with the correct condition: anca_vasculitis (ANCA-associated vasculitis)","Pauci-immune crescentic glomerulonephritis is characteristically associated with ANCA (Anti-Neutrophil Cytoplasmic Antibody) vasculitis, not with anti-GBM IgA nephropathy, minimal change disease, or membranous nephropathy. The 'pauci-immune' term refers to the absence or scarcity of immune deposits on immunofluorescence, which is the hallmark of ANCA-associated vasculitis.",wrong diagnosis,4
93,Remove redundant patient fact argument,"Change patient(john, john) to patient(john) since the predicate only needs one argument to identify the patient","The patient fact is defined with two identical arguments (john, john), which is redundant and inconsistent. It should be a single-argument fact: patient(john), and the rule should be updated accordingly to use patient(Patient).",redundant predicate argument,1
93,Fix the condition predicate to single associated condition,"Replace the three incorrect condition facts with a single correct fact: condition(pauci_immune_crescentic_glomerulonephritis, anca_vasculitis)","There should be only one primary associated condition for pauci-immune crescentic glomerulonephritis, which is ANCA-associated vasculitis. Having multiple wrong conditions produces incorrect diagnoses.",wrong diagnosis,4
94,Change diagnosis to PCP intoxication,"Replace 'cannabinoid_intoxication' with 'pcp_intoxication' in the condition fact, as the clinical presentation (vertical nystagmus, combativeness, hallucinations, slurred speech) is characteristic of PCP (phencyclidine) intoxication, not cannabinoid intoxication.","The key finding of prominent vertical nystagmus is pathognomonic for PCP intoxication, not marijuana/cannabinoid intoxication. The 'different' marijuana was likely laced with PCP.",wrong diagnosis,4
94,Add NMDA receptor as the mechanism,"Add a fact 'receptor(nmda)' and a rule linking pcp_intoxication to the NMDA receptor, such as 'acts_at_receptor(pcp_intoxication, nmda)'.","PCP (phencyclidine) acts as an NMDA receptor antagonist. The correct answer is D (NMDA), and the program must represent this pharmacological mechanism to properly solve the problem.",missing inference rule,30
94,Add laced_substance fact and update substance reasoning,"Replace or supplement 'substance(marijuana)' and 'different_marijuana' with 'substance(pcp)' and a rule such as 'laced_with(marijuana, pcp) :- different_marijuana.' to represent that the marijuana was laced with PCP.","The friend reported the marijuana 'seemed different', indicating it was likely laced with another substance (PCP). The program should model this reasoning to correctly identify PCP as the causative agent.",missing inference rule,30
94,Update condition symptoms list to reflect PCP-specific findings,"Update the condition rule for pcp_intoxication to explicitly highlight 'vertical_nystagmus' as the key differentiating symptom, and add a rule such as 'key_symptom(vertical_nystagmus, pcp_intoxication)' to flag it as pathognomonic.",Vertical nystagmus is the hallmark finding that distinguishes PCP intoxication from other substance intoxications. The program should encode this diagnostic weight to correctly differentiate PCP from cannabinoid or other intoxications.,missing inference rule,30
94,Add final answer predicate linking diagnosis to receptor,"Add a predicate such as 'answer(Receptor) :- diagnosis(pcp_intoxication), acts_at_receptor(pcp_intoxication, Receptor).' so the program can return the correct receptor (nmda) as the final answer.","The medical question asks which receptor is involved, so the program must have a rule that connects the diagnosis to the receptor mechanism and outputs the answer 'nmda' corresponding to option D.",missing inference rule,30
95,Fix unbound variable warnings in facts,"Replace symptom(patient(X), seizures) and similar facts that use unbound variable X with a concrete patient identifier, e.g., symptom(patient(boy_2yo), seizures), symptom(patient(boy_2yo), hypotonia), symptom(patient(boy_2yo), developmental_delay), condition(patient(boy_2yo), genetic_biochemical_disorder), lab_result(patient(boy_2yo), pH(7.34)), lab_result(patient(boy_2yo), pCO2(31)), lab_result(patient(boy_2yo), bicarbonate(17)), metabolite_accumulation(patient(boy_2yo), alanine), metabolite_accumulation(patient(boy_2yo), pyruvate).","Using an unbound singleton variable X in facts is a Prolog anti-pattern and generates warnings. Facts should use ground terms (atoms) as identifiers, not uninstantiated variables.",singleton variable,31
95,Fix rule_acidosis predicate definition,"Rewrite rule_acidosis as proper Prolog rules: rule_acidosis :- lab_result(_, pH(P)), P < 7.35. rule_acidosis :- lab_result(_, bicarbonate(B)), B < 22. The current syntax mixes term structure with clause head arguments incorrectly and uses arithmetic comparison outside of is/2 or proper comparison predicates.","The current rule_acidosis clauses are syntactically malformed. The head contains a comparison expression which is not valid Prolog clause head syntax, and the body calls pH(P) and bicarbonate(B) as if they were predicates when they are terms stored inside lab_result facts.",wrong predicate syntax,1
95,Fix rule_lactic_acidosis predicate definition,"Rewrite rule_lactic_acidosis as a proper rule with an empty or meaningful body: rule_lactic_acidosis :- metabolite_accumulation(_, pyruvate). The current definition treats metabolite_accumulation(patient(X), pyruvate) as a fact/head with no body, which is syntactically a fact asserting a compound term as a predicate rather than a rule checking for pyruvate accumulation.","rule_lactic_acidosis is defined as a fact whose head is the full compound term metabolite_accumulation(patient(X), pyruvate), making it a standalone fact rather than a rule that queries the metabolite_accumulation facts already defined. It should be a rule with a body that calls the existing metabolite_accumulation facts.",wrong predicate structure,1
95,Fix diagnosis rule to properly call rule_acidosis and rule_lactic_acidosis,"Update the diagnosis rule to call the corrected predicates and also verify symptoms: diagnosis(pyruvate_dehydrogenase_deficiency) :- rule_acidosis, rule_lactic_acidosis, metabolite_accumulation(_, alanine), metabolite_accumulation(_, pyruvate), symptom(_, seizures), symptom(_, hypotonia), symptom(_, developmental_delay).","After fixing rule_acidosis and rule_lactic_acidosis to be zero-argument predicates, the diagnosis rule must call them without arguments. Including symptom checks makes the diagnosis rule more complete and representative of the clinical reasoning in the problem.",wrong predicate arity call,1
95,Add answer fact linking diagnosis to correct answer choice,"Add a fact or rule: answer(D) :- diagnosis(pyruvate_dehydrogenase_deficiency), D = 'D. Pyruvate dehydrogenase'. This allows the program to explicitly return the correct answer choice.","The program should produce the final answer corresponding to the multiple-choice question. Without this, the program only derives the enzyme deficiency name but does not map it to the answer option D as required by the problem.",missing answer mapping rule,11
97,Fix side_effect facts for cisplatin and carboplatin,"Change 'side_effect(cisplatin, platinum_based_drugs)' and 'side_effect(carboplatin, platinum_based_drugs)' to 'side_effect(cisplatin, sensorineural_hearing_loss)' and 'side_effect(carboplatin, sensorineural_hearing_loss)' respectively.","The current facts incorrectly state that cisplatin and carboplatin are side effects of platinum_based_drugs, which is semantically wrong. The side_effect predicate should directly link each drug to its side effect (sensorineural_hearing_loss), so that the diagnosis rule can match them correctly.",wrong predicate arguments,1
97,Remove redundant platinum_based_drugs side_effect fact,"Remove or repurpose the fact 'side_effect(platinum_based_drugs, sensorineural_hearing_loss)' since it is no longer needed once cisplatin and carboplatin are directly linked to sensorineural_hearing_loss.","With the corrected side_effect facts for cisplatin and carboplatin, the intermediate platinum_based_drugs fact becomes redundant and could cause confusion or unintended matches in the diagnosis rule.",redundant fact removal,7
97,Identify cisplatin as the primary responsible drug,"Add a specific fact or comment clarifying that cisplatin is the most commonly responsible drug for progressive bilateral sensorineural hearing loss in this clinical context, e.g., 'primary_cause(progressive_bilateral_sensorineural_hearing_loss, cisplatin)'.","While both cisplatin and carboplatin are platinum-based drugs, cisplatin is the drug classically and most strongly associated with ototoxicity (sensorineural hearing loss) in chemotherapy. The program should reflect this clinical distinction to correctly answer the medical problem.",missing clinical distinction,0
97,Update diagnosis rule to reflect primary responsible drug,"Add or modify the diagnosis rule to prioritize cisplatin as the answer, e.g., 'diagnosis(Drug) :- symptom(patient(40,female), progressive_bilateral_sensorineural_hearing_loss), primary_cause(progressive_bilateral_sensorineural_hearing_loss, Drug)'.","The diagnosis rule should leverage the primary_cause fact to return cisplatin as the definitive answer, matching the expected medical answer to the problem.",missing inference rule,30
99,Add HPV Co-testing or Reflex HPV Testing Rule,"Add a fact and rule that specifies reflex HPV testing (or co-testing) as the preferred next step for ASCUS results, rather than defaulting to colposcopy. The rule should state: if pap_smear_result is ascus, then next_step is reflex_hrHPV_testing.","According to current ASCCP guidelines, the recommended next step for ASCUS on a Pap smear is reflex high-risk HPV (hrHPV) testing, not immediate colposcopy. Colposcopy is only indicated if HPV testing is positive. The current code incorrectly jumps to colposcopy as the management step.",missing inference rule,30
99,Add HPV Result-Based Branching Logic,Add rules that branch management based on HPV test results: if hrHPV is positive then next_step is colposcopy; if hrHPV is negative then next_step is routine_screening (repeat Pap in 3 years).,"The program lacks the conditional logic that determines further management based on HPV test results. A negative hrHPV test with ASCUS means the patient can return to routine screening, while a positive result warrants colposcopy. This branching is essential to correctly model the clinical guideline.",missing inference rule,30
99,Correct the diagnosis Rule to Reflect Proper Next Step,"Replace diagnosis(manage_with_colposcopy_if_high_risk_factors_present) with a proper rule: next_step(ascus, reflex_hrHPV_testing) to accurately represent the first-line recommended action.",The current diagnosis fact is vague and clinically inaccurate. ASCUS management is not based on 'high risk factors' in the traditional sense but on HPV co-testing or reflex HPV testing results. The fact misrepresents the guideline and would lead to incorrect clinical decision-making.,wrong diagnosis,4
99,Add Patient History Facts for Context,"Add facts representing the patient's relevant history: normal_pap_history(true), screening_interval(every_3_years), age_first_screening(21), no_past_medical_issues(true). These should be used in the rules to confirm the patient qualifies for standard ASCUS management.","The patient's history (normal prior Pap smears, no medical issues, age-appropriate screening) is clinically relevant and confirms she should follow standard ASCUS guidelines. Including these facts makes the Prolog program more complete and accurate in modeling the clinical scenario.",missing patient context facts,0
102,Fix patient/1 fact and rule call,"Change the fact 'patient(john_doe, 17)' usage in the rule. The predicate 'patient(Patient)' is called with one argument in the diagnosis rule, but the fact is defined with two arguments 'patient(john_doe, 17)'. Change the rule call to 'patient(Patient, _Age)' to match the defined fact arity.","The fact 'patient(john_doe, 17)' has arity 2, but the rule calls 'patient(Patient)' with arity 1, causing a predicate existence error or always failing.",predicate arity mismatch,1
102,Fix duration fact and comparison,"Change 'condition(john_doe, duration(8_months))' to use a plain numeric value, e.g., 'condition(john_doe, duration(8))'. Similarly, change the comparison in the rule from 'Dur > 6_months' to 'Dur > 6'. Prolog does not support underscore-separated atoms like '8_months' as numeric values for arithmetic comparison.","Prolog cannot perform arithmetic comparison on atoms like '8_months' or '6_months'. These must be plain numbers (e.g., 8 and 6) for the '>/2' operator to work correctly.",invalid numeric syntax,26
102,Fix normal_temperature fact,"Change 'condition(john_doe, normal_temperature(98.6_F))' to 'condition(john_doe, normal_temperature(98.6))'. The atom '98.6_F' is not a valid Prolog numeric value.",'98.6_F' is not a valid Prolog number or standard atom and may cause a syntax error. It should be represented as the float '98.6' or a quoted atom '98.6_f'.,invalid atom syntax,9
102,Add diagnosis query or main goal,"Add a queryable clause or a main goal such as ':- diagnosis(Diagnosis), write(Diagnosis), nl.' or expose a predicate 'diagnose(Patient, Diagnosis)' so the program can actually be queried to produce the diagnosis result.",The program defines the diagnosis rule but provides no way to invoke or display the result. A query or entry-point predicate is needed to actually solve the problem and return the diagnosis.,missing entry point predicate,1
103,Fix diagnosis predicate to identify clear cell renal cell carcinoma,"Change the diagnosis rule to produce a specific diagnosis term 'clear_cell_renal_cell_carcinoma' rather than just using the patient variable X. The rule should be: diagnosis(X, clear_cell_renal_cell_carcinoma) :- patient(X, _), symptom(X, painless_hematuria), condition(X, right_flank_mass), condition(X, clear_cell_cytoplasm), condition(X, hemorrhage_areas), condition(X, necrosis_areas).","The current diagnosis rule only binds the patient variable but does not produce a named diagnosis. The chromosomal_abnormality rule tries to call diagnosis(clear_cell_renal_cell_carcinoma) treating the diagnosis name as a patient, which will always fail. The diagnosis predicate needs a second argument to represent the disease name.",wrong predicate arity,1
103,Fix chromosomal_abnormality rule to correctly reference the diagnosis,"Update the chromosomal_abnormality rule to: chromosomal_abnormality(Patient, deletion_3p) :- diagnosis(Patient, clear_cell_renal_cell_carcinoma). This links the patient's diagnosis to the correct chromosomal abnormality.","The current rule passes 'clear_cell_renal_cell_carcinoma' as a patient identifier to diagnosis/1, which will never match any patient fact. It also does not specify what the chromosomal abnormality actually is.",wrong predicate arguments,1
103,Add the correct chromosomal abnormality fact for clear cell RCC,"Add a fact or ensure the chromosomal_abnormality rule returns 'deletion_3p' (deletion of the short arm of chromosome 3, i.e., del(3p)) as the specific cytogenetic finding associated with clear cell renal cell carcinoma.",Clear cell renal cell carcinoma is classically associated with deletion of chromosome 3p (involving the VHL gene locus at 3p25). The program must represent this specific chromosomal abnormality as the answer to the medical question.,missing knowledge base fact,6
103,Add a query or main rule to retrieve the chromosomal abnormality for the patient,"Add a top-level rule such as: find_chromosomal_abnormality(Patient, Abnormality) :- chromosomal_abnormality(Patient, Abnormality). This allows querying the system with find_chromosomal_abnormality(john_doe, X) to retrieve the answer 'deletion_3p'.","Without a proper query interface, the program cannot be used to answer the medical question about what chromosomal abnormality is present in this patient's tumor.",missing query interface,23
104,Add axillary nerve injury condition,"Add a specific condition fact for axillary nerve injury with its associated symptoms: condition(axillary_nerve_injury, [weak_lateral_rotation, nerve_injury]).",The axillary nerve is the specific nerve responsible for lateral rotation of the arm (via the teres minor and deltoid muscles). A fall from a tree house causing shoulder trauma is a classic mechanism for axillary nerve injury. The current code lacks this specific condition.,missing condition fact,30
104,Remove or correct brachial_plexus_injury as primary diagnosis,"Either remove the brachial_plexus_injury condition or make it less specific, since the most likely diagnosis for isolated weak lateral arm rotation is axillary nerve injury, not a general brachial plexus injury.","Brachial plexus injury is too broad and non-specific for this clinical scenario. The symptom of isolated weak lateral rotation points specifically to axillary nerve injury, not a general brachial plexus injury.",wrong diagnosis,4
104,Fix diagnosis rule to require ALL symptoms to match,"Change the diagnosis rule to require that ALL symptoms of a condition are present in the patient, not just one. Replace the current rule with: diagnosis(X) :- condition(X, Symptoms), forall(member(Symptom, Symptoms), symptom(john, Symptom)).","The current rule diagnoses a condition if ANY single symptom matches, which is logically incorrect and would cause false positives. A proper diagnosis should require all defining symptoms of a condition to be present in the patient.",overly permissive matching condition,28
104,Remove radial_nerve_injury condition,"Remove the condition(radial_nerve_injury, [nerve_injury]) fact from the program.","Radial nerve injury causes weakness in wrist/finger extension, not lateral arm rotation. It is clinically irrelevant to this scenario and would produce an incorrect diagnosis.",wrong diagnosis,4
