question_index,fix_name,fix_description,reason,tag,tag_cluster
134,Fix condition for fracture_anatomic_neck,"Update the condition for anatomic neck fracture to 'condition(fracture_anatomic_neck, causes_avascular_necrosis).' or keep it distinct from surgical neck by removing 'causes_weakness_abduction' overlap, since anatomic neck fractures primarily cause avascular necrosis of the humeral head rather than nerve damage.","Anatomic neck fractures disrupt blood supply to the humeral head causing avascular necrosis, not typically nerve damage or sensory loss. Distinguishing the conditions of anatomic vs surgical neck fractures is essential for correct differential diagnosis in the program.",wrong diagnosis,4
136,Fix unbound variable in diagnosis rule,The variable X in diagnosis(X) is never bound to anything. Change the rule head to diagnosis(deep_venous_thrombosis) or add X = deep_venous_thrombosis inside the rule body so the predicate actually returns the diagnosed condition.,"As written, X is a singleton/unbound variable, so calling diagnosis(X) would succeed but X would remain uninstantiated, making the predicate useless for retrieving the diagnosis.",singleton variable,31
136,Fix invalid atom for duration (5_days),"Replace the atom 5_days with a valid Prolog atom such as five_days or '5_days' (quoted), or use a compound term like days(5). The underscore-led numeric token 5_days is not a standard Prolog atom and will cause a syntax/parse error in most Prolog systems.",Prolog atoms cannot begin with a digit followed by an underscore in standard syntax; this will cause a syntax error when the file is consulted.,invalid atom syntax,9
136,Add redness symptom fact,"Add the fact symptom(redness_right_calf, present) (or a similarly named fact) to represent the clinical finding of redness in the right calf, since the diagnosis rule checks for redness as a condition but there is no corresponding symptom fact for it.","The condition fact condition(deep_venous_thrombosis, redness) is asserted, but no symptom fact for redness exists. The diagnosis rule should verify that the patient actually exhibits redness, so a symptom fact and a corresponding check in the rule are needed for completeness.",missing symptom fact,12
136,Add management/treatment rule,"Add a predicate such as management(deep_venous_thrombosis, anticoagulation_therapy) and a rule best_initial_step(Step) :- diagnosis(deep_venous_thrombosis), management(deep_venous_thrombosis, Step). This represents the answer to the clinical question: the best initial step is anticoagulation (e.g., low-molecular-weight heparin).","The medical problem asks for the best initial management step, but the program contains no facts or rules about treatment or management, so it cannot answer the actual clinical question posed.",missing inference rule,30
136,Add risk factor checks to diagnosis rule,"Extend the diagnosis rule to also check symptom(prior_hypertension, history) and symptom(recent_pneumonia, hospitalization), since recent hospitalization is a major DVT risk factor and is part of the clinical reasoning. This makes the rule reflect the full clinical picture rather than ignoring the history.","The symptom facts for hypertension and recent hospitalization are declared but never used in the diagnosis rule, so the rule does not fully represent the clinical reasoning described in the problem.",missing inference rule,30
136,Add age and gender relevance to diagnosis rule,"Use the bound values from patient(Age, Gender) inside the rule, for example by asserting that Age >= 60 increases DVT risk, so the rule body should include Age >= 60 after retrieving Age from the patient fact.","The patient age and gender are retrieved via patient(Age, Gender) but Age and Gender are never used in the rule body, making them singleton variables and causing a Prolog warning; incorporating them makes the rule clinically meaningful.",singleton variable,31
143,Add degenerative brain changes fact,"Add a fact 'degenerative(alzheimer, brain_changes).' to explicitly represent that Alzheimer's involves degenerative changes in the brain.","The medical problem specifically asks about a condition characterized by degenerative brain changes. This property is not represented anywhere in the current code, making the program incomplete in modeling the problem.",missing domain fact,15
143,Add not normal aging fact,Add a fact 'not_normal_aging(alzheimer).' to represent that the condition is distinct from normal aging processes.,A key distinguishing characteristic in the problem is that the condition is 'not part of normal aging'. This property is entirely absent from the current code and must be included to accurately represent the medical problem.,missing domain fact,15
143,Update diagnosis rule to include degenerative and not normal aging conditions,"Modify the diagnosis rule to: 'diagnosis(X) :- patient(_, Y), symptom(X, Y), condition(X, chronic), degenerative(X, brain_changes), not_normal_aging(X).'","The current diagnosis rule only checks for symptoms and chronic condition, but does not verify that the condition involves degenerative brain changes that are not part of normal aging, which are the defining characteristics stated in the medical problem.",missing inference rule,30
143,Fix diagnosis rule variable binding for patient,"Update the diagnosis rule to bind the patient variable: 'diagnosis(Patient, X) :- patient(Patient, Y), symptom(X, Y), condition(X, chronic), degenerative(X, brain_changes), not_normal_aging(X).'","The current rule uses an anonymous variable '_' for the patient, making it impossible to know which patient received the diagnosis. Binding the patient variable makes the rule more useful and medically meaningful.",anonymous variable in rule,31
144,Add MRI recommendation rule,"Add a rule that recommends MRI as the next step in management when a meniscus injury is diagnosed and x-ray is normal. Example: next_step(Patient, mri_knee) :- diagnosis(meniscus_injury), xray(Patient, normal).",The problem asks for the most appropriate next step in management. MRI is the gold standard imaging for soft tissue injuries like meniscal tears when x-ray is normal. The code currently has no management or next-step recommendation rules.,missing inference rule,30
144,Bind Patient variable in diagnosis rule,"The diagnosis rule uses an unbound Patient variable across multiple goals but never explicitly binds it to 'john_doe'. It should be refactored to pass Patient as an argument: diagnosis(Patient, meniscus_injury) :- patient(Patient, _), symptom(Patient, left_knee_pain), ...","The current rule uses a local variable 'Patient' that is only bound within the scope of the rule, but the predicate diagnosis/1 does not expose the patient identity, making it impossible to link the diagnosis back to a specific patient for further management queries.",singleton variable,31
144,Add McMurray test or physical exam finding,"Add a fact for a positive McMurray test or Thessaly test as a physical examination finding, e.g., condition(john_doe, positive_mcmurray_test), and include it as an optional supporting condition in the diagnosis rule.",The clinical scenario implies classic meniscal injury signs. Including McMurray or Thessaly test positivity makes the diagnostic rule more clinically accurate and representative of the actual physical examination findings used to diagnose meniscal tears.,missing clinical finding,0
144,Add management/treatment recommendation rules,"Add rules for management steps such as: management(Patient, mri_knee) :- diagnosis(Patient, meniscus_injury). This should also include conservative options like rest, ice, and physiotherapy as initial steps if MRI confirms the tear.","The program only models diagnosis but does not address the management question posed in the problem. The next step after clinical suspicion of meniscal injury with a normal x-ray is to order an MRI of the knee, which must be represented in the code.",missing inference rule,30
144,Add sport/mechanism of injury fact,"Add a fact representing the mechanism of injury during basketball, e.g., mechanism(john_doe, sports_injury) or activity(john_doe, basketball), and incorporate it into the diagnosis rule.",The mechanism of injury (twisting during basketball) is clinically relevant for diagnosing a meniscal tear. Including it improves the accuracy and completeness of the diagnostic rule.,missing clinical fact,0
145,Add normal_parathyroid_hormone to hypercalcemia rule,"Include laboratory_result(john_doe, normal_parathyroid_hormone) as a condition in the hypercalcemia rule to distinguish PTHrP-mediated hypercalcemia from primary hyperparathyroidism.","Normal PTH is a critical finding that rules out primary hyperparathyroidism. Including it in the rule ensures the diagnosis correctly reflects the lab pattern: elevated calcium + high PTHrP + low phosphate + normal PTH, which together point to humoral hypercalcemia of malignancy.",missing inference rule condition,30
145,Add weakness and decreased_concentration to malignancy rule,"Include symptom(john_doe, weakness) and symptom(john_doe, decreased_concentration) as conditions in the malignancy rule.",Weakness and decreased concentration are classic neuromuscular and neurological symptoms of hypercalcemia associated with malignancy. Including them makes the diagnostic rule more clinically complete and accurate.,missing inference rule,30
145,Add high_parathyroid_hormone_related_protein to malignancy rule,"Include laboratory_result(john_doe, high_parathyroid_hormone_related_protein) as a condition in the malignancy rule.",Elevated PTHrP is the key laboratory marker that distinguishes humoral hypercalcemia of malignancy from other causes. It should be explicitly checked in the malignancy rule rather than only inherited indirectly through the hypercalcemia condition.,missing inference rule,30
145,Refine diagnosis to humoral_hypercalcemia_of_malignancy,"Change the diagnosis fact and rule from 'malignancy' to 'humoral_hypercalcemia_of_malignancy', and update the condition rule accordingly.","The specific cause of hypercalcemia asked in the problem is humoral hypercalcemia of malignancy (HHM), driven by PTHrP secretion from a tumor. Simply diagnosing 'malignancy' is too vague and does not answer the question about the mechanism of hypercalcemia.",wrong diagnosis,4
145,Add normal_parathyroid_hormone to malignancy rule,"Include laboratory_result(john_doe, normal_parathyroid_hormone) as a condition in the malignancy (or humoral_hypercalcemia_of_malignancy) rule.",Normal PTH explicitly rules out primary hyperparathyroidism as the cause of hypercalcemia. Its presence in the malignancy rule ensures the differential diagnosis is correctly resolved toward PTHrP-mediated malignancy-associated hypercalcemia.,missing inference rule,30
146,Correct hematoma association with lucid interval,"Change condition(subdural_hematoma, lucid_interval) to condition(epidural_hematoma, lucid_interval), and change condition(epidural_hematoma, rapid_unconsciousness) to condition(subdural_hematoma, rapid_unconsciousness)","Epidural hematoma is the classic hematoma associated with a lucid interval following initial unconsciousness, not subdural hematoma. The lucid interval occurs because the initial trauma causes brief unconsciousness, followed by a period of apparent recovery as the epidural hematoma slowly expands from arterial bleeding (typically the middle meningeal artery), before rapid deterioration occurs.",swapped condition associations,28
146,Fix diagnosis rule logic,"Replace the diagnosis rule with: diagnosis(Patient, Hematoma) :- patient(Patient, head_injury), symptom(Patient, unconsciousness), symptom(Patient, lucid_interval), condition(Hematoma, lucid_interval).","The current rule tries to unify the patient variable X with the condition variable Subdural (X = Subdural), which is logically incorrect. The diagnosis should return the type of hematoma associated with the lucid interval symptom, not try to match the patient name with the condition name. The rule should bind a separate Hematoma variable to the condition associated with the lucid interval.",wrong variable unification,5
147,Fix condition fact atom consistency,"Change the condition fact to use consistent atom formatting. The list in condition/2 uses atoms with underscores ('maternal_Rh_negative', 'paternal_Rh_positive') but the symptom facts use atoms with spaces ('maternal Rh negative', 'paternal Rh positive'). Standardize all atoms to use underscores: symptom(maternal_Rh_negative, risk_factor) and symptom(paternal_Rh_positive, risk_factor).","Inconsistent atom naming between symptom/2 facts and condition/2 list members causes the program to have disconnected facts that cannot be unified, making the knowledge base incoherent.",atom naming inconsistency,9
147,Add fetus Rh negative fact for risk clarification,"Add a fact or rule specifying that the fetus is at risk when it inherits the paternal Rh positive gene, i.e., fetus_rh_risk(positive) :- condition('hemolytic disease of newborn', _). Also add a fact: at_risk_combination(maternal_Rh_negative, paternal_Rh_positive).","The problem asks specifically which maternal-paternal Rh combination puts the fetus at risk. The fetus inherits Rh positive from the father, and the Rh-negative mother produces anti-D antibodies that cross the placenta and attack fetal red blood cells. This causal chain should be explicitly represented.",missing inference rule,30
147,Add sensitization rule via prior blood transfusion,"Add a rule that links the patient's history of blood transfusions to prior Rh sensitization: sensitized(Patient) :- patient(Patient, 'received blood transfusions'), patient(Patient, 'maternal Rh negative'). And update the diagnosis rule to include sensitization as a contributing factor.","The clinical scenario specifically mentions prior blood transfusions as the mechanism of sensitization in an Rh-negative mother. This is medically critical because it means the mother is already sensitized and anti-D antibodies are already present, increasing the risk of hemolytic disease of the newborn even in a first pregnancy.",missing inference rule,30
147,Add explicit maternal Rh negative patient fact,"Add the fact patient('maternal Rh negative', 'true') or patient(mother, rh_negative) to explicitly represent the mother's Rh status in the patient facts, and add patient(father, rh_positive) for the father's Rh status.","The patient facts do not currently include the Rh blood type information for either the mother or the father, which is the central element needed to answer the medical question about which combination puts the fetus at risk.",missing patient fact,0
147,Fix diagnosis rule to produce meaningful output,"Update the diagnosis rule to explicitly state the at-risk combination and explain the mechanism: diagnosis('hemolytic disease of newborn risk') :- patient(mother, rh_negative), patient(father, rh_positive), condition('hemolytic disease of newborn', Factors), member(maternal_Rh_negative, Factors), member(paternal_Rh_positive, Factors).","The current diagnosis rule checks condition/2 but does not connect to the patient facts, so it cannot actually reason about the specific patient scenario. The rule must integrate patient data with the condition logic to produce a valid diagnosis.",missing inference rule,30
149,Add Kleihauer-Betke Test as Next Step,"Add a fact or rule specifying that the next_step is the Kleihauer-Betke test (acid elution test), which is the standard method to quantify fetal-maternal hemorrhage and determine if additional doses of Rh immunoglobulin are needed.","The Prolog code only identifies the condition as 'fetal_maternal_hemorrhage_assessment' but does not specify the actual clinical next step, which is the Kleihauer-Betke test. This test detects and quantifies fetal red blood cells in maternal circulation to calculate the volume of hemorrhage and determine additional anti-D dosing.",missing inference rule,30
149,Add next_step Rule for Kleihauer-Betke Test,Add a rule such as: next_step(kleihauer_betke_test) :- diagnosis(fetal_maternal_hemorrhage_assessment). This links the diagnosis to the specific recommended action.,"The program lacks a rule that maps the diagnosis to the concrete next clinical step. The Kleihauer-Betke test is the answer to the medical question, and the program should explicitly represent and derive this recommendation.",missing inference rule,30
149,Add Fact for Heavy Bleeding Symptom,Add symptom(heavy_bleeding) as a fact to accurately represent the clinical scenario described in the problem.,"The problem explicitly mentions heavy bleeding due to retained placenta, which is a clinically relevant symptom that increases the risk of significant fetal-maternal hemorrhage. This fact is missing from the current code and should be included for completeness and accuracy.",missing fact,6
149,Add Additional Anti-D Dosing Rule,"Add a rule such as: additional_anti_d_needed(X) :- next_step(kleihauer_betke_test), fmh_volume(X), X > 30. This represents the clinical decision that additional Rh immunoglobulin doses are needed if fetal-maternal hemorrhage exceeds 30 mL (one standard dose covers ~30 mL of fetal whole blood).","The program should represent the full clinical reasoning chain: the Kleihauer-Betke test result determines whether additional anti-D doses are required, with one additional vial needed per 30 mL of fetal whole blood detected beyond what the initial dose covers.",missing inference rule,30
149,Rename Diagnosis Term to Reflect Specific Test,"Change X = fetal_maternal_hemorrhage_assessment to X = kleihauer_betke_test within the diagnosis rule, or create a separate next_step predicate that resolves to kleihauer_betke_test.","The current diagnosis term 'fetal_maternal_hemorrhage_assessment' is vague and does not specify the actual procedure. The correct and specific answer to the medical question is the Kleihauer-Betke test, and the Prolog code should explicitly name this test as the conclusion.",wrong diagnosis,4
150,Fix glomerulonephritis diagnosis rule to bind Patient variable,"The diagnosis rule for glomerulonephritis uses an unbound variable 'Patient' across multiple condition calls but never binds it to a specific patient. It should be bound to patient(53,male) or use a consistent variable that gets unified, e.g., by adding patient(Age, Gender) and using patient(Age,Gender) as the Patient term.","In Prolog, the variable 'Patient' in the diagnosis(glomerulonephritis) rule is never instantiated, so the conditions may not unify correctly with the stored facts. It should be explicitly bound to the patient term, e.g., Patient = patient(53, male), or the rule should include a call that binds it.",unbound variable in rule,18
150,Replace anti_pbam with anti_C1q or correct antibody,"The antibody identified as 'anti_pbam' is not a recognized medical entity for this clinical presentation. Based on the findings (membranoproliferative glomerulonephritis pattern with subendothelial deposits, tram-track appearance, decreased complement, purpuric rash, and renal involvement), the most likely antibody is anti-C1q (associated with hypocomplementemic urticarial vasculitis or lupus nephritis) or more specifically anti-dsDNA (for lupus nephritis / MPGN type I). The correct antibody should be 'anti_dsDNA' (for SLE-associated MPGN) or 'anti_C1q'. The diagnosis fact should be renamed accordingly, e.g., diagnosis(anti_dsDNA).","'anti_pbam' does not correspond to any known antibody in the context of membranoproliferative glomerulonephritis with the described findings. The clinical picture (purpuric rash, decreased complement, subendothelial deposits, tram-track pattern, granular IF) is classic for lupus nephritis (MPGN pattern), where anti-dsDNA antibodies are the hallmark, or for cryoglobulinemic MPGN where rheumatoid factor / anti-HCV antibodies may be present.",wrong medical entity name,13
150,Add granular_immunofluorescence condition to the antibody diagnosis rule,The rule for the specific antibody diagnosis only checks for tram_track_basement_membrane_splitting but should also verify granular_immunofluorescence as it is a key distinguishing feature of immune-complex mediated MPGN and helps narrow down the antibody.,Granular immunofluorescence is a critical finding that distinguishes immune-complex MPGN (associated with anti-dsDNA or cryoglobulins) from other causes. Including it makes the diagnostic rule more accurate and medically precise.,missing diagnostic condition,4
150,Add a query/output predicate to display the identified antibody,"Add a predicate such as 'likely_antibody(Patient, Antibody) :- diagnosis(Antibody).' or a main query goal that prints the result, so the program can be queried to return the identified antibody for the patient.",The program currently has no way to output or query the final answer (the antibody) in a user-friendly manner. A predicate linking the patient to the antibody conclusion is needed to make the program fully functional as a diagnostic tool.,missing output predicate,1
153,Fix recursive diagnosis predicate,Replace the recursive call `diagnosis(chronic_lymphocytic_leukemia)` with `X = chronic_lymphocytic_leukemia` to properly unify the output variable and avoid infinite recursion.,"The predicate `diagnosis(X)` calls itself recursively with `diagnosis(chronic_lymphocytic_leukemia)` instead of unifying X with the result, causing infinite recursion and never producing a result.",infinite recursion in predicate,1
153,Fix Patient variable binding,"Replace the unbound `Patient` variable in symptom calls with the actual patient term `patient(70, male)`, or bind it properly using `Patient = patient(Age, Gender)` after the `patient(Age, Gender)` fact.","The variable `Patient` in `symptom(Patient, ...)` is never unified with the result of `patient(Age, Gender)`, so the symptom lookups may fail or behave unexpectedly.",unbound variable reference,18
153,Fix blood_film percentage representation,"Change the blood_film symptom fact from `blood_film(mature_lymphocytes, over_70_percent)` to a numeric representation such as `blood_film(mature_lymphocytes, 70)`, and update the rule to check `Percent > 70` against a numeric value.",The atom `over_70_percent` cannot be numerically compared with `> 70`. A numeric value is required for arithmetic comparison in Prolog.,wrong data type representation,13
153,Add next best investigation predicate,"Add a predicate `next_investigation(X, Investigation)` that, given a diagnosis of `chronic_lymphocytic_leukemia`, returns `flow_cytometry` (immunophenotyping) as the next best investigation to definitively confirm the diagnosis.","The medical problem asks for the next best investigation to definitively diagnose CLL. The answer is flow cytometry (immunophenotyping of peripheral blood lymphocytes), which is not represented anywhere in the current code.",missing inference rule,30
153,Remove unused condition facts,"Remove or properly integrate `condition(condition2, hiv_infection)` and restructure condition facts so they are actually used in the diagnosis logic.","The condition facts are defined but never used in any rule, making them dead code that does not contribute to the diagnostic reasoning.",dead code removal,34
155,Correct Diagnosis from Intussusception to Intestinal Obstruction/Ileus,"Change the diagnosis rule conclusion from 'intussusception' to 'intestinal obstruction' or more specifically 'neonatal intestinal obstruction'. The combination of bilious vomiting, gross abdominal distention, absent bowel sounds, and multiple gas-filled loops on X-ray in a 7-day-old infant is classic for neonatal intestinal obstruction (such as ileus or atresia), not intussusception.","Intussusception typically occurs in infants aged 6 months to 2 years and presents with intermittent colicky pain, currant jelly stools, and a sausage-shaped mass. A 7-day-old neonate with bilious vomiting, gross abdominal distention, absent bowel sounds, and multiple gas-filled loops is more consistent with neonatal intestinal obstruction (e.g., jejunal/ileal atresia, meconium ileus, or Hirschsprung's disease).",wrong diagnosis,4
155,Fix Patient Identifier Syntax,Change the patient identifier from 'patient/1' to a valid Prolog atom such as 'patient1' or use a proper term like 'patient(1)'. The slash '/' in 'patient/1' is a valid operator in Prolog but is unconventional and may cause unintended behavior. The variable 'Patient' in the diagnosis rule will not unify correctly with the compound term 'patient/1' unless handled carefully.,"In Prolog, 'patient/1' is interpreted as the division operator applied to 'patient' and '1', which is not a standard atom. Using 'patient1' or 'patient(1)' as a consistent identifier across facts and rules ensures proper unification and avoids potential parsing issues.",invalid atom syntax,9
155,Add Patient Variable Binding in Diagnosis Rule,"Ensure the variable 'Patient' in the diagnosis rule is properly bound by referencing the same patient across all symptom and condition checks. The rule should explicitly bind 'Patient' to a specific individual before checking symptoms and conditions, for example by adding a 'patient(Patient)' fact or ensuring all predicates share the same variable.","Without a proper binding mechanism, the variable 'Patient' could unify with any term, potentially leading to incorrect diagnoses if multiple patients are added. Adding a 'patient(patient1)' fact and referencing it in the rule ensures the diagnosis is correctly scoped to a specific patient.",unbound variable in rule,18
157,Fix typo in projectile_vomiting atom,Change 'projectile_vomoting' to 'projectile_vomiting' in the diagnosis rule where member/2 is called.,"The atom 'projectile_vomoting' is a typo and will never unify with 'projectile_vomiting' stored in the condition fact, causing the diagnosis rule to always fail.",atom typo mismatch,9
